{
  "schemaVersion": "1.0.0",
  "registryVersion": "1.0.0",
  "publicInvocations": [
    "build",
    "audit",
    "redesign",
    "study"
  ],
  "registries": {
    "modules": "modules.json",
    "principles": "principles.json",
    "domains": "domains.json",
    "profiles": "profiles.json",
    "relations": "relations.json",
    "scoring": "scoring.json"
  }
}
